{
  "contractVersion": "0.1.0",
  "requestId": "SYNTH-REQ-0001",
  "recommendationId": "SYNTH-REC-0001",
  "decisionId": "SYNTH-DEC-0001",
  "decisionMakerReference": "SYNTH-DELEGATE-001",
  "delegationAuthorityReference": "SYNTH-DELEGATION-001",
  "humanDecisionConfirmed": true,
  "outcomeCode": "approved",
  "approvedScopeReferences": [
    "SYNTH-SCOPE-001"
  ],
  "conditionReferences": [],
  "supervisionPlanReference": null,
  "commencementDate": "2026-10-01",
  "expiryDate": "2029-09-30",
  "communicationReference": "SYNTH-COMM-001",
  "decisionHash": "bbbbbbbbbbbbbbbbbbbbbbbbbbbbbbbbbbbbbbbbbbbbbbbbbbbbbbbbbbbbbbbb",
  "authoritativeRegisterUpdated": false,
  "releaseToPractiseConfirmed": false
}
